{
  "$schema": "http://json-schema.org/draft-07/schema#",
  "$id": "https://schemas.payment-platform.internal/events/payment-authorized/v1",
  "title": "PaymentAuthorized v1",
  "description": "Emitted by payment-domain (via outbox) when the payment provider has authorized the payment. Published to payments.lifecycle.v1.",
  "type": "object",
  "additionalProperties": false,
  "required": [
    "schema_version",
    "message_id",
    "correlation_id",
    "source_service",
    "occurred_at",
    "event_type",
    "payload"
  ],
  "properties": {
    "schema_version": {
      "type": "string",
      "enum": ["1"],
      "description": "Monotonic integer version of this schema encoded as a string. Consumers MUST skip (and warn on) unknown versions."
    },
    "message_id": {
      "type": "string",
      "format": "uuid",
      "description": "Globally unique message identifier. Used as idempotency key by consumers (inbox/dedup pattern)."
    },
    "correlation_id": {
      "type": "string",
      "format": "uuid",
      "description": "Propagated across all services in the same business transaction. Set once at the transaction boundary."
    },
    "causation_id": {
      "type": "string",
      "format": "uuid",
      "description": "message_id of the upstream message that caused this one. Omitted at the start of a causal chain."
    },
    "source_service": {
      "type": "string",
      "enum": ["payment-domain"],
      "description": "Service that produced this message."
    },
    "occurred_at": {
      "type": "string",
      "format": "date-time",
      "description": "ISO-8601 UTC timestamp of when the event occurred (not published). Must include timezone (Z or offset)."
    },
    "event_type": {
      "type": "string",
      "const": "payment.authorized",
      "description": "Fully-qualified event type identifier."
    },
    "payload": {
      "type": "object",
      "additionalProperties": false,
      "required": ["payment_id", "merchant_id", "provider_id", "amount", "status"],
      "properties": {
        "payment_id": {
          "type": "string",
          "format": "uuid",
          "description": "Authoritative payment identifier owned by payment-domain."
        },
        "merchant_id": {
          "type": "string",
          "format": "uuid",
          "description": "Identifier of the merchant who initiated the payment."
        },
        "provider_id": {
          "type": "string",
          "enum": ["stripe", "adyen", "braintree"],
          "description": "External payment provider used for authorization."
        },
        "provider_reference": {
          "type": "string",
          "description": "Provider's own transaction or charge identifier (present after authorization)."
        },
        "amount": {
          "type": "object",
          "additionalProperties": false,
          "required": ["value", "currency"],
          "properties": {
            "value": {
              "type": "integer",
              "minimum": 0,
              "description": "Amount in minor currency units."
            },
            "currency": {
              "type": "string",
              "pattern": "^[A-Z]{3}$",
              "description": "ISO-4217 three-letter currency code."
            }
          }
        },
        "status": {
          "type": "string",
          "const": "authorized",
          "description": "Payment status at the time this event was emitted."
        },
        "idempotency_key": {
          "type": "string",
          "description": "Merchant-supplied idempotency key from the original payment request."
        }
      }
    }
  }
}